{"$schema":"https://json-schema.org/draft/2020-12/schema","title":"State Machine v3","type":"object","required":["schemaVersion","id","resourceId","initialStateId","states"],"properties":{"schemaVersion":{"const":3},"id":{"type":"string","minLength":1},"scope":{"type":"string"},"resourceId":{"type":"string"},"initialStateId":{"type":"string"},"activationAction":{"type":"string"},"states":{"type":"array","items":{"type":"object","required":["id"],"properties":{"id":{"type":"string"},"transitions":{"type":"array"},"modifiers":{"type":"array"}}}}}}
